<?xml version="1.0" encoding="UTF-8"?>
<xs:schema xmlns:xs="http://www.w3.org/2001/XMLSchema">
    <xs:element name="discografica">
        <xs:complexType>
            <xs:sequence>
                <xs:element name="grupos">
                    <xs:complexType>
                        <xs:sequence>
                            <xs:element name="grupo" minOccurs="1" maxOccurs="unbounded">
                                <xs:complexType>
                                    <xs:all>
                                        <xs:element name="componentes" >
                                            <xs:complexType>
                                                <xs:sequence>
                                                    <xs:element name="componente" minOccurs="3" maxOccurs="6">
                                                        <xs:complexType>
                                                            <xs:simpleContent>
                                                                <xs:extension base="xs:string">
                                                                    <xs:attribute name="instrumento" type="xs:string"></xs:attribute>
                                                                </xs:extension>
                                                            </xs:simpleContent>
                                                        </xs:complexType>
                                                    </xs:element>
                                                </xs:sequence>
                                            </xs:complexType>
                                        </xs:element>
                                        <xs:element name="discos">
                                            <xs:complexType>
                                                <xs:sequence>
                                                    <xs:element name="disco" minOccurs="0" maxOccurs="5">
                                                        <xs:complexType>
                                                            <xs:simpleContent>
                                                                <xs:extension base="xs:string">
                                                                    <xs:attribute name="orden" type="xs:unsignedInt"></xs:attribute>
                                                                </xs:extension>
                                                            </xs:simpleContent>
                                                        </xs:complexType>
                                                    </xs:element>
                                                </xs:sequence>
                                            </xs:complexType>
                                        </xs:element>
                                    </xs:all>
                                    <xs:attribute name="nombre" type="xs:string"></xs:attribute>
                                    <xs:attribute name="estilo" type="xs:string"></xs:attribute>
                                </xs:complexType>
                            </xs:element>
                        </xs:sequence>
                    </xs:complexType>
                </xs:element>
            </xs:sequence>
        </xs:complexType>
    </xs:element>
</xs:schema>